sub_078,"Yes, they were clear.",No i did not notice the visible pictures stayed the same on the blue board.,"No, i did not notice.","no, i did not notice.","No i did not notice, i just thought they all moved randomly on each board.",I just tried to remember if they were located to the left or right or high or low and clicked based on this strategy.,"They hindered me on all boards, especially if they moved.",It was a good study. I think maybe make clear if its ok to get the majority incorrect because it was difficult to get some that were correct.
sub_079,"All clear, just took me a while to get used to the first round",Yes,No,No I didn't notice thus,No,I just tried to focus on the invisible pictures and build an image in my mind of where they were.,They hindered when they moved as was unable to use them when trying to envision how the board looked in full.,N/A
sub_080,Yes,Yes,No,Nope,Nope,Yeah they would typically appear in the same positions,help,not sure
sub_081,The instructions were clear,Yes,Cannot recall,Cannot recall,Cannot recall,"Divided attention between hidden picture relationship with visible picture, and hidden picture location on board",Visible pictures helped at times and hindered at times - could not be relied upon exclusively,No issues other than having to adjust screen size at start of experiment
sub_082,Very simple to understand,I can't remember,Yes,No,Yes,"No, just tried to remember general locations relative to the centre of the board","Hindered, if they had stayed the same it would have helped but changing just made it worse",Nope!
sub_083,yes,yes,yes,no,no,"seeing which pictures they were next to, how close they were",help,no
sub_084,They were clear,Yes,Yes,"I didn't notice how many moved, though I knew some did",Yes,"I tried to work out which ones were next to the other pictures. I found these easier to place, but I still found hitting the exact area almost impossible. I have commented to say that the pictures should really be bigger against the grid.",They helped,"Larger images on the grid please. I came extremely close on many of the guesses, but they still count as 'incorrect'"
sub_085,Yes,"Yes, it was helpful",Yes,No,Yes,No,"Helped on the blue board, didn't help on the others ",No
